{
  "specversion": "1.0",
  "id": "kubernetes:team/payments@2026-10-06T14:10:00.000000Z",
  "source": "adapter/kubernetes",
  "type": "dev.bearing.observation.v1",
  "time": "2026-10-06T14:10:00Z",
  "datacontenttype": "application/json",
  "data": {
    "entity": {
      "kind": "Team",
      "key": "kubernetes:team/payments",
      "attributes": {
        "name": "payments"
      }
    }
  }
}
