[
  {
    "specversion": "1.0",
    "id": "github:repo/acme/x@2026-09-28T02:00:00.000000Z",
    "source": "adapter/github",
    "type": "dev.bearing.observation.v1",
    "time": "2026-09-28T02:00:00Z",
    "datacontenttype": "application/json",
    "data": {
      "entity": {
        "kind": "Repository",
        "key": "github:repo/acme/x",
        "attributes": {
          "archived": false,
          "default_branch": "",
          "full_name": "acme/x",
          "name": "x",
          "url": "https://github.com/acme/x"
        },
        "deleted": true
      },
      "evidence": {
        "url": "https://github.com/acme/x"
      }
    }
  }
]
