{
  "specversion": "1.0",
  "id": "kubernetes:namespace/k3d-acme/payments@2026-10-06T14:10:00.000000Z",
  "source": "adapter/kubernetes",
  "type": "dev.bearing.observation.v1",
  "time": "2026-10-06T14:10:00Z",
  "datacontenttype": "application/json",
  "data": {
    "entity": {
      "kind": "Environment",
      "key": "kubernetes:namespace/k3d-acme/payments",
      "attributes": {
        "name": "payments",
        "cluster": "k3d-acme"
      }
    }
  }
}
